{
  "capabilityPolicy": {
    "allowed": [],
    "denied": [
      "credential-read",
      "external-network",
      "model-request",
      "repository-command",
      "repository-write",
      "user-config-read"
    ]
  },
  "caseId": "d16-copilot-vscode-manual-review",
  "client": "ide-surface-needs-reviewed-manual-observation",
  "contractVersion": "0.1.0",
  "expectedLoadedSourceSequence": [".github/instructions/api.instructions.md"],
  "fixtureFiles": [
    {
      "content": "D15_COPILOT_VSCODE_RULE\nSynthetic observation marker.\n",
      "markerId": "D15_COPILOT_VSCODE_RULE",
      "path": ".github/instructions/api.instructions.md"
    }
  ],
  "observedAt": "2026-08-02T20:18:08Z",
  "operation": "blocked-paid-observation",
  "profileId": "copilot-vscode",
  "recordKind": "agent-context-real-client-observation-plan",
  "settingSources": ["ide-runtime", "repository-fixture"],
  "supervisor": null,
  "surfaceId": "copilot-vscode/local-chat"
}
